{
  "title": {
    "en": "“Your Sins Are Forgiven”",
    "zh-Hant": null
  },
  "main_point": {
    "en": "Our obedience shows Jesus’s power to forgive sin and transform hearts.",
    "zh-Hant": null
  },
  "christ_connection": {
    "en": "Jesus’s claim to have the authority to forgive sins was supported by His miraculous healings. Jesus would later suffer and die to provide forgiveness of sin and would miraculously be raised from the dead on the third day.",
    "zh-Hant": null
  },
  "scripture": {
    "title": {
      "en": "Walking Evidence",
      "zh-Hant": null
    },
    "reference": "Mark 2",
    "content": [
      {
        "title": {
          "en": "Only Jesus Can Forgive Our Sin",
          "zh-Hant": null
        },
        "reference": "Mark 2:1-7",
        "content": {
          "en": "1 And when he returned to Capernaum after some days, it was reported that he was at home. 2 And many were gathered together, so that there was no more room, not even at the door. And he was preaching the word to them. 3 And they came, bringing to him a paralytic carried by four men. 4 And when they could not get near him because of the crowd, they removed the roof above him, and when they had made an opening, they let down the bed on which the paralytic lay. 5 And when Jesus saw their faith, he said to the paralytic, “Son, your sins are forgiven.” 6 Now some of the scribes were sitting there, questioning in their hearts, 7 “Why does this man speak like that? He is blaspheming! Who can forgive sins but God alone?”",
          "zh-Hant": null
        }
      },
      {
        "title": {
          "en": "Obedience Is Evidence of Transformation",
          "zh-Hant": null
        },
        "reference": "Mark 2:8-12",
        "content": {
          "en": "8 And immediately Jesus, perceiving in his spirit that they thus questioned within themselves, said to them, “Why do you question these things in your hearts? 9 Which is easier, to say to the paralytic, ‘Your sins are forgiven,’ or to say, ‘Rise, take up your bed and walk’? 10 But that you may know that the Son of Man has authority on earth to forgive sins”—he said to the paralytic— 11 “I say to you, rise, pick up your bed, and go home.” 12 And he rose and immediately picked up his bed and went out before them all, so that they were all amazed and glorified God, saying, “We never saw anything like this!”",
          "zh-Hant": null
        }
      }
    ]
  },
  "before_you_teach": {
    "leader_only": true,
    "content": {
      "en": "Leaders: This week, consider how loving Jesus precedes and prompts obedience to Jesus’s commands (John 14:15).",
      "zh-Hant": null
    },
    "commentary": [
      {
        "title": {
          "en": "Only Jesus Can Forgive Our Sin",
          "zh-Hant": null
        },
        "content": [
          {
            "reference": "Mark 2:5",
            "content": {
              "en": "“It was a staggering claim, and we should understand it not only as a further exposition of Jesus’s authority but also as another sign of the diminishing role of the temple. This is the second time in the Gospel when a prophetic figure opens a means of forgiveness outside the cultic center in Jerusalem. John the Baptist had called people to the desert to receive a baptism of repentance for the forgiveness of sins (1:4). And here in the village of Capernaum in rural Galilee Jesus declared that the Son of Man came to forgive sin on earth. Furthermore, Jesus’s declaration follows a revelation of His power to make clean irrespective of the authority of the priests in the temple.”¹",
              "zh-Hant": null
            }
          },
          {
            "reference": "Mark 2:7",
            "content": {
              "en": "“Blasphemy is irreverent, profane, impious speech about God; and its penalty in Old Testament times was death (Lev. 24:16). Here the charge prepares the way for the same accusation at Jesus’s trial (14:60-64). The scribes were certainly correct that the Scriptures everywhere teach that ‘God alone,’ or better ‘One, even God’ or ‘the one God,’ can forgive sins. Nor did Jesus deny this. What they failed to recognize was that the reign of God had drawn near in Jesus and that He had authority to act on God’s behalf.”²",
              "zh-Hant": null
            }
          }
        ]
      },
      {
        "title": {
          "en": "Obedience Is Evidence of Transformation",
          "zh-Hant": null
        },
        "content": [
          {
            "reference": "Mark 2:10-12",
            "content": {
              "en": "“At the point when the paralytic stood up, the world of tangible forms served as a sign for a spiritual truth. The man’s physical disease symbolized his spiritual condition, and Jesus’s power to heal his body authenticated the claim to restore his standing before God. When Jesus touched the leper, He shattered the social and religious conventions of his day. A new power had entered the world. It was the power to make people clean. It was not dependent upon the laws and rites of the temple. It operated outside the jurisdiction of the recognized religious authorities. Here that new power pressed its claim one step further. No physical condition rendered this man unfit to stand before God. The problem was sin, and Jesus did not make him clean by healing his body; Jesus made him clean by forgiving his sin.”³",
              "zh-Hant": null
            }
          }
        ]
      }
    ]
  },
  "context": {
    "leader_only": true,
    "content": {
      "en": "In the Gospel of Mark, the writer (John Mark) focuses more on Jesus’s miracles rather than His teachings. Jesus’s teachings are sprinkled throughout the Gospel, but His miracles served as evidence: He is the Messiah for whom the people had been waiting. More precisely, John Mark wrote to a mostly Gentile audience, aiming to prove that Jesus was the true Son of God and to disprove the Roman belief that hailed Caesar as the “son of God.” Jews expected the Messiah to come as a political ruler, who would re-establish Israel’s rule and reign, but Jesus came in a way no one expected, not even His disciples (Mark 8:31-32). He came for more than the Jews, to serve rather than be served, and to give His life for our sin (Mark 10:45). How can we know Jesus is the Son of God, who has the authority to forgive sins? Jesus’s miracles are evidence of His power, pointing us to the incredible reality that sinners find forgiveness in Him. In Mark’s Gospel, Jesus’s identity as the Son of God was confirmed and recognized by God the Father (1:11; 9:7); by unclean spirits and demons (3:11; 5:7); by Peter (8:27-30); and even by a Roman Centurion, who witnessed Jesus’s last hour and said, “Truly this man was the Son of God!” (15:39). We can rest in the truth that Jesus has authority to forgive even the worst sinner.",
      "zh-Hant": null
    }
  },
  "theology_connection": {
    "title": {
      "en": "Sin’s Effects in the World",
      "zh-Hant": null
    },
    "content": {
      "en": "Sin does not only impact our relationship with God; it is also the root of our broken relationships with the people around us. Human sinfulness is the reason that creation groans in anticipation for redemption and deliverance from its bondage to evil powers (Rom. 8:20-22). Sin has infected and redirected the social structures of society, leading to injustice and oppression. The distorting effects of sin are visible all around us, but the good news of the gospel is that the battle against these powers will be won through the work of Christ.",
      "zh-Hant": null
    },
    "prayer": {
      "leader_only": true,
      "content": {
        "en": "Heavenly Father, give us eyes to see the devastation of sin in our world and in our lives. Thank You for giving Your Son so that we can be freed from sin. Holy Spirit, apply the healing forgiveness that comes through salvation to our hearts and minds.",
        "zh-Hant": null
      }
    }
  },
  "kick_starter": {
    "leader_only": true,
    "title": {
      "en": "Rate It!",
      "zh-Hant": null
    },
    "id": "kick-starter",
    "question": {
      "en": "How important is it for a superhero to have the power to heal themselves (1=Not needed; 10=Mandatory!)?",
      "zh-Hant": null
    }
  },
  "intro_activity": {
    "leader_only": true,
    "title": {
      "en": "Power of Forgiveness",
      "zh-Hant": null
    },
    "supplies": {
      "en": "None",
      "zh-Hant": null
    },
    "instructions": {
      "en": "These optional activities are designed to help your students interact. You'll find a Discussion Activity and a Cultural Connection, which touches on a relevant topic in today’s teen culture. Each group is different, so adapt these activities to fit your group’s needs. The goal is for students to connect more to the lesson as they connect to the topic and to one another.\n\nAsk the following questions, allowing time for students to share responses:",
      "zh-Hant": null
    },
    "questions": [
      {
        "id": "activity-1",
        "question": {
          "en": "How would you define forgiveness?",
          "zh-Hant": null
        }
      },
      {
        "id": "activity-2",
        "question": {
          "en": "Who is the most forgiving person you know?",
          "zh-Hant": null
        }
      },
      {
        "id": "activity-3",
        "question": {
          "en": "Why is asking for forgiveness or giving forgiveness sometimes hard?",
          "zh-Hant": null
        }
      }
    ],
    "content": {
      "en": "Forgiveness is the act of releasing someone of guilt. Because of sin, our need for forgiveness never decreases; it only increases as we continue to sin. Jesus taught about forgiveness—both our need for it and the command to give it. As we experience God’s forgiveness, we must also grow in the ability to forgive others.",
      "zh-Hant": null
    }
  },
  "cultural_connection": {